<?xml version="1.0" encoding="UTF-8"?>

<ModInfo xmlns:xsi="http://www.w3.org/2001/XMLSchema-instance"
    xsi:noNamespaceSchemaLocation="https://raw.githubusercontent.com/Inadequado4192/RWML-Public/master/Languages/Scheme.xsd">
    <authors>
        <li>
            <nickname>Inadequado</nickname>
            <links>
                <discord>inadequado4192</discord>
                <instagram>https://www.instagram.com/inadequado4192</instagram>
                <steam>https://steamcommunity.com/id/inadequado4192</steam>
            </links>
        </li>
    </authors>
    <lastUpdate>2023-11-22T15:00:55.432Z</lastUpdate>
    <note>Наразі перекладено всі рядки, але переклад неточний.</note>
</ModInfo>